city,hotel_name,acc_type,price,hotel_star,no_of_ratings,rating,occupancy,lat_long
Orlando,"Sonesta ES Suites Orlando - International Drive, Orlando",HOTEL,$129 ,3.5-star,See all 859 Hotels.com reviews,8.8,"1 room, 3 adults","['28.441941', '-81.47115']"
Orlando,"CoCo Key Hotel and Water Resort-Orlando, Orlando",HOTEL,$65 ,3-star,"See all 1,845 Hotels.com reviews",6.4,"1 room, 3 adults","['28.45468', '-81.470854']"
Orlando,"The Grand Orlando Resort at Celebration, Kissimmee",HOTEL,$62 ,3.5-star,"See all 2,946 Hotels.com reviews",6.8,"1 room, 3 adults","['28.33647', '-81.534655']"
Orlando,"Holiday Inn & Suites Across From Universal Orlando, Orlando",HOTEL,$79 ,3-star,See all 873 Hotels.com reviews,7.8,"1 room, 3 adults","['28.477329', '-81.457288']"
Orlando,"Howard Johnson by Wyndham Tropical Palms Kissimmee, Kissimmee",HOTEL,$30 ,2-star,"See all 1,423 Hotels.com reviews",5.8,"1 room, 3 adults","['28.304833', '-81.455483']"
Orlando,"Baymont by Wyndham Kissimmee, Kissimmee",HOTEL,$59 ,2.5-star,See all 433 Hotels.com reviews,6,"1 room, 3 adults","['28.303313', '-81.44829']"
Orlando,"Holiday Inn Orlando International Airport, Orlando",HOTEL,$88 ,3-star,See all 412 Hotels.com reviews,7.2,"1 room, 3 adults","['28.46027', '-81.309057']"
Orlando,"Clarion Inn Lake Buena Vista, a Rosen Hotel, Orlando",HOTEL,$150 ,3-star,"See all 1,417 Hotels.com reviews",8,"1 room, 3 adults","['28.387403', '-81.499148']"
Orlando,"Days Inn & Suites by Wyndham Altamonte Springs, Altamonte Springs",HOTEL,$71 ,2-star,See all 523 Hotels.com reviews,5.2,"1 room, 3 adults","['28.660884', '-81.393403']"
Orlando,"Delta Hotels by Marriott Orlando Lake Buena Vista, Orlando",HOTEL,$79 ,4-star,See all 815 Hotels.com reviews,8.6,"1 room, 3 adults","['28.38414', '-81.505944']"
Orlando,"Hyatt Regency Orlando International Airport, Orlando",HOTEL,$199 ,4-star,"See all 1,763 Hotels.com reviews",9,"1 room, 3 adults","['28.431373', '-81.305213']"
Orlando,"Seralago Hotel & Suites Main Gate East, Kissimmee",HOTEL,$55 ,3-star,"See all 3,195 Hotels.com reviews",6.2,"1 room, 3 adults","['28.332726', '-81.511951']"
Orlando,"Best Western Orlando East Inn & Suites, Orlando",HOTEL,$89 ,2.5-star,See all 563 Hotels.com reviews,7.4,"1 room, 3 adults","['28.568406', '-81.264167']"
Orlando,"Bryan's Spanish Cove by Diamond Resorts, Orlando",HOTEL,$148 ,3-star,See all 336 Hotels.com reviews,9,"1 room, 3 adults","['28.362681', '-81.501165']"
Orlando,"Renaissance Orlando Airport Hotel by Marriott, Orlando",HOTEL,$118 ,4-star,See all 468 Hotels.com reviews,8.6,"1 room, 3 adults","['28.460379', '-81.31317']"
Orlando,"The Villas of Grand Cypress, Orlando",HOTEL,$223 ,4.5-star,See all 241 Hotels.com reviews,9.6,"1 room, 3 adults","['28.405897', '-81.528661']"
Orlando,"Days Inn by Wyndham N Orlando/Casselberry, Fern Park",HOTEL,$85 ,2-star,See all 190 Hotels.com reviews,5.2,"1 room, 3 adults","['28.650083', '-81.350144']"
Orlando,"Avanti International Resort, Orlando",HOTEL,$74 ,3-star,"See all 3,905 Hotels.com reviews",7.6,"1 room, 3 adults","['28.439032', '-81.47157']"
Orlando,"Flamingo Waterpark Resort, Kissimmee",HOTEL,$41 ,3-star,"From 512 reviews
TripAdvisor Traveller Rating",6.6,"1 room, 3 adults","['28.28522', '-81.352644']"
Orlando,"Buena Vista Suites, Orlando",HOTEL,$88 ,3.5-star,"See all 2,222 Hotels.com reviews",8,"1 room, 3 adults","['28.357377', '-81.494643']"
Orlando,"Avanti Palms Resort and Conference Center, Orlando",HOTEL,$80 ,3.5-star,"See all 1,953 Hotels.com reviews",6.6,"1 room, 3 adults","['28.458296', '-81.47017']"
Orlando,"The Suites at Magic Tree, Kissimmee",HOTEL,,3-star,See all 28 Hotels.com reviews,9.4,"1 room, 3 adults","['28.328156', '-81.590693']"
Orlando,"Four Points by Sheraton Orlando International Drive, Orlando",HOTEL,$101 ,3.5-star,See all 627 Hotels.com reviews,8,"1 room, 3 adults","['28.462304', '-81.461441']"
Orlando,"Legacy Vacation Resorts-Orlando, Kissimmee",HOTEL,$66 ,3-star,"See all 1,487 Hotels.com reviews",7.4,"1 room, 3 adults","['28.329881', '-81.489634']"
Orlando,"Courtyard by Marriott Orlando Airport, Orlando",HOTEL,$74 ,3-star,See all 316 Hotels.com reviews,8.4,"1 room, 3 adults","['28.459671', '-81.312231']"
Orlando,"Disney's Port Orleans Resort - Riverside, Lake Buena Vista",HOTEL,$215 ,3.5-star,See all 640 Hotels.com reviews,8.6,"1 room, 3 adults","['28.385062', '-81.536421']"
Orlando,"Marriott Orlando Downtown, Orlando",HOTEL,$130 ,3.5-star,See all 350 Hotels.com reviews,8,"1 room, 3 adults","['28.547271', '-81.384604']"
Orlando,"DoubleTree by Hilton at the Entrance to Universal Orlando, Orlando",HOTEL,$98 ,4-star,"See all 2,017 Hotels.com reviews",8.4,"1 room, 3 adults","['28.477995', '-81.457445']"
Orlando,"Club Orlando, Orlando",HOTEL,,2.5-star,See all 77 Hotels.com reviews,7.8,"1 room, 3 adults","['28.489394', '-81.405168']"
Orlando,"Sulaf Hotel LBV South, Kissimmee",HOTEL,$45 ,2.5-star,"From 374 reviews
TripAdvisor Traveller Rating",5.2,"1 room, 3 adults","['28.33465', '-81.48153']"
Orlando,"Hampton Inn Orlando Near Universal Blv/International Dr, Orlando",HOTEL,$89 ,2.5-star,See all 472 Hotels.com reviews,8.6,"1 room, 3 adults","['28.459562', '-81.458814']"
Orlando,"Holiday Inn Club Vacations at Orange Lake Resort, Kissimmee",HOTEL,$129 ,4-star,"See all 1,239 Hotels.com reviews",8.4,"1 room, 3 adults","['28.347126', '-81.623788']"
Orlando,"Econo Lodge Kissimmee, Kissimmee",HOTEL,$40 ,1.5-star,See all 789 Hotels.com reviews,5,"1 room, 3 adults","['28.335745', '-81.495856']"
Orlando,"Courtyard by Marriott Orlando International Dr / Conv Cntr, Orlando",HOTEL,$79 ,3-star,See all 195 Hotels.com reviews,8.8,"1 room, 3 adults","['28.441357', '-81.472136']"
Orlando,"Ramada by Wyndham Orlando Florida Mall, Orlando",HOTEL,$99 ,2.5-star,See all 517 Hotels.com reviews,8.4,"1 room, 3 adults","['28.439911', '-81.403731']"
Orlando,"Embassy Suites by Hilton Orlando International Dr Conv Ctr, Orlando",HOTEL,$114 ,3.5-star,See all 493 Hotels.com reviews,8.6,"1 room, 3 adults","['28.438167', '-81.472006']"
Orlando,"Royale Parc Suites Kissimmee, Kissimmee",HOTEL,$84 ,3-star,"See all 1,009 Hotels.com reviews",8,"1 room, 3 adults","['28.33274', '-81.519783']"
Orlando,"Quality Inn Orlando Airport, Orlando",HOTEL,$64 ,2.5-star,"See all 1,646 Hotels.com reviews",7,"1 room, 3 adults","['28.451408', '-81.350129']"
Orlando,"Orbit One Vacation Villas by Diamond Resorts, Kissimmee",HOTEL,$94 ,3-star,See all 463 Hotels.com reviews,8.8,"1 room, 3 adults","['28.334698', '-81.592519']"
Orlando,"Rosen Plaza on International Drive, Orlando",HOTEL,$111 ,3.5-star,See all 606 Hotels.com reviews,9,"1 room, 3 adults","['28.430266', '-81.470502']"
Orlando,"Enclave Hotel & Suites Orlando, a staySky Hotel & Resort, Orlando",HOTEL,$125 ,2.5-star,See all 463 Hotels.com reviews,7.2,"1 room, 3 adults","['28.456016', '-81.468601']"
Orlando,"Red Lion Hotel Orlando Lake Buena Vista South, Kissimmee",HOTEL,$81 ,3.5-star,See all 381 Hotels.com reviews,9,"1 room, 3 adults","['28.332774', '-81.488954']"
Orlando,"Holiday Inn Orlando SW - Celebration Area, Kissimmee",HOTEL,$64 ,3-star,"From 1,770 reviews
TripAdvisor Traveller Rating",7,"1 room, 3 adults","['28.332942', '-81.512784']"
Orlando,Travelodge Suites by Wyndham Kissimmee Orange,HOTEL,$50 ,2-star,See all 731 Hotels.com reviews,6.4,"1 room, 3 adults","['28.332976', '-81.499648']"
Orlando,"Florida Vacation Villas, Kissimmee",HOTEL,$109 ,3.5-star,See all 39 Hotels.com reviews,7,"1 room, 3 adults","['28.328092', '-81.488943']"
Orlando,"Sheraton Suites Orlando Airport, Orlando",HOTEL,$101 ,3.5-star,"See all 1,045 Hotels.com reviews",8.8,"1 room, 3 adults","['28.456375', '-81.307386']"
Orlando,"Sheraton Orlando North Hotel, Maitland",HOTEL,$93 ,3.5-star,See all 931 Hotels.com reviews,8.4,"1 room, 3 adults","['28.632999', '-81.391052']"
Orlando,"Disney's Beach Club Villas, Lake Buena Vista",HOTEL,$436 ,4-star,"From 910 reviews
TripAdvisor Traveller Rating",9.4,"1 room, 3 adults","['28.371753', '-81.556387']"
Orlando,"Rosen Inn at Pointe Orlando, Orlando",HOTEL,$72 ,3-star,"See all 2,033 Hotels.com reviews",8.2,"1 room, 3 adults","['28.433898', '-81.47213']"
Orlando,"Disney's Old Key West Resort, Lake Buena Vista",HOTEL,$540 ,3.5-star,See all 36 Hotels.com reviews,9,"1 room, 3 adults","['28.375826', '-81.533339']"
Orlando,"Quality Suites, Orlando",HOTEL,$71 ,2.5-star,See all 808 Hotels.com reviews,6.4,"1 room, 3 adults","['28.430306', '-81.475095']"
Orlando,"Disney's Caribbean Beach Resort, Lake Buena Vista",HOTEL,$204 ,3.5-star,See all 621 Hotels.com reviews,7.8,"1 room, 3 adults","['28.362218', '-81.541168']"
Orlando,"Hyatt Regency Orlando, Orlando",HOTEL,$139 ,4.5-star,"See all 1,360 Hotels.com reviews",9,"1 room, 3 adults","['28.427353', '-81.469432']"
Orlando,"Hilton Orlando/Altamonte Springs, Altamonte Springs",HOTEL,$114 ,4-star,See all 310 Hotels.com reviews,8,"1 room, 3 adults","['28.655206', '-81.386327']"
Orlando,"Courtyard by Marriott Lake Buena Vista at Vista Centre, Orlando",HOTEL,$85 ,3-star,See all 940 Hotels.com reviews,8,"1 room, 3 adults","['28.385735', '-81.502502']"
Orlando,"Walt Disney World Swan, Lake Buena Vista",HOTEL,$143 ,4-star,"See all 1,685 Hotels.com reviews",8.6,"1 room, 3 adults","['28.364007', '-81.559448']"
Orlando,"Travelodge by Wyndham Orlando Downtown Centroplex, Orlando",HOTEL,$99 ,2-star,See all 450 Hotels.com reviews,5,"1 room, 3 adults","['28.54776', '-81.376756']"
Orlando,"Celebration Suites, Kissimmee",HOTEL,$65 ,3-star,"From 5,685 reviews
TripAdvisor Traveller Rating",7.6,"1 room, 3 adults","['28.332729', '-81.517824']"
Orlando,"Rodeway Inn, Apopka",HOTEL,$69 ,2-star,See all 33 Hotels.com reviews,5.4,"1 room, 3 adults","['28.659053', '-81.476134']"
Orlando,"DoubleTree by Hilton Orlando Downtown, Orlando",HOTEL,$118 ,3.5-star,See all 695 Hotels.com reviews,8,"1 room, 3 adults","['28.559566', '-81.378796']"
Orlando,"Residence Inn Orlando Altamonte Springs/Maitland, Altamonte Springs",HOTEL,$99 ,3-star,See all 135 Hotels.com reviews,8.6,"1 room, 3 adults","['28.664578', '-81.39038']"
Orlando,"Disney's Contemporary Resort, Lake Buena Vista",HOTEL,$530 ,4-star,See all 220 Hotels.com reviews,8.6,"1 room, 3 adults","['28.416657', '-81.57678']"
Orlando,"Disney's All-Star Music Resort, Lake Buena Vista",HOTEL,$106 ,3-star,"See all 1,183 Hotels.com reviews",8.2,"1 room, 3 adults","['28.3413', '-81.572153']"
Orlando,"Disney's Yacht Club Resort, Lake Buena Vista",HOTEL,$380 ,4-star,See all 144 Hotels.com reviews,9,"1 room, 3 adults","['28.372695', '-81.560311']"
Orlando,"Rosen Inn International, Orlando",HOTEL,$72 ,3-star,"See all 1,702 Hotels.com reviews",8,"1 room, 3 adults","['28.452879', '-81.470849']"
Orlando,"Orlando World Center Marriott, Orlando",HOTEL,$179 ,4-star,See all 779 Hotels.com reviews,8.6,"1 room, 3 adults","['28.360086', '-81.508582']"
Orlando,"Rosen Centre Hotel, Orlando",HOTEL,$119 ,4-star,See all 881 Hotels.com reviews,9,"1 room, 3 adults","['28.42553', '-81.464421']"
Orlando,"Hilton Orlando Lake Buena Vista - Disney Springs® Area, Lake Buena Vista",HOTEL,$137 ,4-star,"See all 1,369 Hotels.com reviews",8,"1 room, 3 adults","['28.373878', '-81.511337']"
Orlando,"Econo Lodge Inn & Suites Near Florida Mall, Orlando",HOTEL,$70 ,2.5-star,See all 538 Hotels.com reviews,5.6,"1 room, 3 adults","['28.438795', '-81.404098']"
Orlando,"TownePlace Suites Orlando Altamonte Springs/Maitland, Altamonte Springs",HOTEL,$107 ,3-star,See all 65 Hotels.com reviews,9.2,"1 room, 3 adults","['28.663256', '-81.390337']"
Orlando,"Sheraton Orlando Lake Buena Vista Resort, Orlando",HOTEL,$99 ,4-star,"See all 1,230 Hotels.com reviews",7.4,"1 room, 3 adults","['28.386596', '-81.506226']"
Orlando,"DoubleTree by Hilton Orlando Airport, Orlando",HOTEL,$112 ,3.5-star,See all 337 Hotels.com reviews,8.2,"1 room, 3 adults","['28.463252', '-81.311731']"
Orlando,"Radisson Hotel Orlando-Lake Buena Vista, Orlando",HOTEL,$99 ,3.5-star,"See all 1,490 Hotels.com reviews",8.4,"1 room, 3 adults","['28.379342', '-81.504839']"
Orlando,"Hampton Inn closest to Universal Orlando, Orlando",HOTEL,$108 ,2.5-star,See all 399 Hotels.com reviews,9,"1 room, 3 adults","['28.485543', '-81.456739']"
Orlando,"Walt Disney World Dolphin, Lake Buena Vista",HOTEL,$169 ,4-star,"See all 2,957 Hotels.com reviews",8.2,"1 room, 3 adults","['28.36749', '-81.56149']"
Orlando,"Days Inn by Wyndham Orlando Near Millenia Mall, Orlando",HOTEL,$44 ,2-star,"See all 1,796 Hotels.com reviews",4.2,"1 room, 3 adults","['28.508172', '-81.416658']"
Orlando,"Ramada by Wyndham Orlando Near Convention Center, Orlando",HOTEL,$60 ,2.5-star,"See all 1,004 Hotels.com reviews",5.8,"1 room, 3 adults","['28.444862', '-81.472482']"
Orlando,"Parc Corniche Condominium Suite Hotel, Orlando",HOTEL,$99 ,3-star,See all 667 Hotels.com reviews,7.8,"1 room, 3 adults","['28.399183', '-81.460788']"
Orlando,"Travelodge by Wyndham Orlando Near Florida Mall, Orlando",HOTEL,$46 ,2-star,See all 503 Hotels.com reviews,4.6,"1 room, 3 adults","['28.435938', '-81.403564']"
Orlando,"Embassy Suites Lake Buena Vista Resort, Orlando",HOTEL,$95 ,4-star,"See all 1,057 Hotels.com reviews",8.4,"1 room, 3 adults","['28.391337', '-81.495362']"
Orlando,"Silver Lake Resort, Kissimmee",HOTEL,,3.5-star,See all 442 Hotels.com reviews,8.8,"1 room, 3 adults","['28.344384', '-81.592922']"
Orlando,"Palazzo Lakeside Hotel, an Ascend Hotel Collection Member, Kissimmee",HOTEL,$62 ,2.5-star,"From 90 reviews
TripAdvisor Traveller Rating",8,"1 room, 3 adults","['28.332479', '-81.480459']"
Orlando,"The Cabins at Disney's Fort Wilderness Resort, Lake Buena Vista",HOTEL,$290 ,3.5-star,See all 156 Hotels.com reviews,9.2,"1 room, 3 adults","['28.393578', '-81.555359']"
Orlando,"Orlando Airport Marriott Lakeside, Orlando",HOTEL,$110 ,4-star,See all 550 Hotels.com reviews,8.8,"1 room, 3 adults","['28.45622', '-81.306558']"
Orlando,"Best Western Orlando West, Orlando",HOTEL,$99 ,2.5-star,See all 474 Hotels.com reviews,6.8,"1 room, 3 adults","['28.552762', '-81.40642']"
Orlando,"Baymont by Wyndham Celebration, Kissimmee",HOTEL,$54 ,3-star,"See all 2,625 Hotels.com reviews",7,"1 room, 3 adults","['28.337484', '-81.591571']"
Orlando,"Quality Inn & Suites Near the Theme Parks, Orlando",HOTEL,$76 ,2.5-star,See all 482 Hotels.com reviews,7.8,"1 room, 3 adults","['28.485696', '-81.457015']"
Orlando,"Holiday Inn Orlando - Disney Springs® Area, Lake Buena Vista",HOTEL,$101 ,3.5-star,"See all 1,069 Hotels.com reviews",8.6,"1 room, 3 adults","['28.375475', '-81.50901']"
Orlando,"Wyndham Orlando Resort International Drive, Orlando",HOTEL,$87 ,3.5-star,"See all 2,175 Hotels.com reviews",7.2,"1 room, 3 adults","['28.449873', '-81.468173']"
Orlando,"La Quinta Inn by Wyndham Orlando International Drive North, Orlando",HOTEL,$76 ,2.5-star,See all 798 Hotels.com reviews,7.4,"1 room, 3 adults","['28.463127', '-81.460262']"
Orlando,"Boulder Ridge Villas at Disney's Wilderness Lodge, Lake Buena Vista",HOTEL,"$1,073 ",4-star,See all 10 Hotels.com reviews,9,"1 room, 3 adults","['28.406962', '-81.572713']"
Orlando,"B Resort & Spa in the Disney Springs Resort Area™, Lake Buena Vista",HOTEL,$119 ,4-star,"See all 3,153 Hotels.com reviews",8,"1 room, 3 adults","['28.377449', '-81.507795']"
Orlando,"Disney's Port Orleans Resort French Quarter, Lake Buena Vista",HOTEL,$250 ,3.5-star,See all 338 Hotels.com reviews,8.8,"1 room, 3 adults","['28.378948', '-81.537274']"
Orlando,"Days Inn by Wyndham Orlando Conv. Center/International Dr, Orlando",HOTEL,$70 ,2-star,See all 775 Hotels.com reviews,7,"1 room, 3 adults","['28.423259', '-81.461377']"
Orlando,"Florida Hotel & Conference Center in the Florida Mall, BW Premier Collection, Orlando",HOTEL,$127 ,3.5-star,"See all 1,040 Hotels.com reviews",8.8,"1 room, 3 adults","['28.443426', '-81.395541']"
Orlando,"Clarion Inn & Suites Across From Universal Orlando Resort, Orlando",HOTEL,$76 ,3-star,"From 658 reviews
TripAdvisor Traveller Rating",8,"1 room, 3 adults","['28.477346', '-81.455275']"
Orlando,"Days Inn & Suites by Wyndham Davenport, Davenport",HOTEL,,2-star,See all 259 Hotels.com reviews,6.4,"1 room, 3 adults","['28.230284', '-81.649731']"
Orlando,"Royale Parc Hotel Orlando - Lake Buena Vista , Orlando",HOTEL,$71 ,2.5-star,"From 1,615 reviews
TripAdvisor Traveller Rating",7.6,"1 room, 3 adults","['28.385594', '-81.502712']"
Orlando,"Holiday Inn Orlando East - UCF Area, Orlando",HOTEL,$96 ,3.5-star,See all 365 Hotels.com reviews,8.8,"1 room, 3 adults","['28.567849', '-81.207844']"
Orlando,"Days Inn & Suites by Wyndham Orlando East UCF Area, Orlando",HOTEL,$76 ,2-star,See all 286 Hotels.com reviews,5.4,"1 room, 3 adults","['28.567218', '-81.210101']"
Orlando,"Hilton Orlando Buena Vista Palace - Disney Springs® Area, Lake Buena Vista",HOTEL,$143 ,4-star,"See all 1,481 Hotels.com reviews",7.8,"1 room, 3 adults","['28.376932', '-81.514908']"
Orlando,"Quality Suites, Orlando",HOTEL,$68 ,2-star,"From 25 reviews
TripAdvisor Traveller Rating",7.4,"1 room, 3 adults","['28.453849', '-81.468652']"
Orlando,"Disney's Polynesian Village Resort, Lake Buena Vista",HOTEL,$488 ,4-star,See all 85 Hotels.com reviews,8.4,"1 room, 3 adults","['28.403802', '-81.582662']"
Orlando,"Quality Inn & Suites By the Parks, Kissimmee",HOTEL,$79 ,3-star,See all 534 Hotels.com reviews,8.6,"1 room, 3 adults","['28.334658', '-81.592499']"
Orlando,"DoubleTree by Hilton Hotel Orlando at SeaWorld, Orlando",HOTEL,$79 ,3.5-star,"See all 1,148 Hotels.com reviews",7.6,"1 room, 3 adults","['28.418021', '-81.460006']"
Orlando,"Baymont by Wyndham Florida Mall, Orlando",HOTEL,$37 ,2.5-star,See all 465 Hotels.com reviews,6.6,"1 room, 3 adults","['28.43692', '-81.404465']"
Orlando,"Ramada by Wyndham Kissimmee Downtown Hotel, Kissimmee",HOTEL,,3-star,See all 317 Hotels.com reviews,6,"1 room, 3 adults","['28.304392', '-81.443861']"
Orlando,"Disney's Grand Floridian Resort & Spa, Lake Buena Vista",HOTEL,$482 ,4.5-star,See all 259 Hotels.com reviews,9,"1 room, 3 adults","['28.411036', '-81.590285']"
Orlando,"Castle Hotel, Autograph Collection, Orlando",HOTEL,$111 ,4-star,See all 406 Hotels.com reviews,9,"1 room, 3 adults","['28.439629', '-81.469088']"
Orlando,"Wyndham Lake Buena Vista Disney Springs® Resort Area, Lake Buena Vista",HOTEL,$103 ,4-star,"From 6,721 reviews
TripAdvisor Traveller Rating",8.4,"1 room, 3 adults","['28.374776', '-81.510462']"
Orlando,"Holiday Inn Resort Orlando - Lake Buena Vista, Orlando",HOTEL,$74 ,3.5-star,"See all 1,164 Hotels.com reviews",8.4,"1 room, 3 adults","['28.371878', '-81.503454']"
Orlando,"The Alfond Inn, Winter Park",HOTEL,$249 ,4-star,See all 331 Hotels.com reviews,9.6,"1 room, 3 adults","['28.595984', '-81.347304']"
Orlando,"DoubleTree by Hilton Hotel Orlando East - UCF Area, Orlando",HOTEL,$95 ,3.5-star,See all 511 Hotels.com reviews,8.8,"1 room, 3 adults","['28.599293', '-81.210936']"
Orlando,"Ramada by Wyndham Altamonte Springs, Altamonte Springs",HOTEL,$79 ,2.5-star,See all 437 Hotels.com reviews,6.2,"1 room, 3 adults","['28.663729', '-81.390367']"
Orlando,"Rodeway Inn International Drive, Orlando",HOTEL,$51 ,2.5-star,"See all 2,579 Hotels.com reviews",3.6,"1 room, 3 adults","['28.443549', '-81.472312']"
Orlando,"Red Lion Hotel Orlando Kissimmee Maingate, Kissimmee",HOTEL,$60 ,3-star,"From 2,256 reviews
TripAdvisor Traveller Rating",7.8,"1 room, 3 adults","['28.332744', '-81.582743']"
Orlando,"Maingate Lakeside Resort, Kissimmee",HOTEL,$49 ,3-star,"See all 3,294 Hotels.com reviews",5.8,"1 room, 3 adults","['28.340968', '-81.594749']"
Orlando,"Crowne Plaza Orlando - Downtown, Orlando",HOTEL,$103 ,3.5-star,See all 787 Hotels.com reviews,8.4,"1 room, 3 adults","['28.552431', '-81.383092']"
Orlando,"Quality Inn At International Drive, Orlando",HOTEL,$74 ,2.5-star,"See all 1,327 Hotels.com reviews",7.4,"1 room, 3 adults","['28.445093', '-81.472527']"
Orlando,"Disney's All-Star Sports Resort, Lake Buena Vista",HOTEL,$106 ,3-star,"See all 1,489 Hotels.com reviews",8.4,"1 room, 3 adults","['28.344814', '-81.575916']"
Orlando,"Knights Inn Maingate Kissimmee Orlando, Kissimmee",HOTEL,$40 ,2-star,See all 649 Hotels.com reviews,4.6,"1 room, 3 adults","['28.332808', '-81.586561']"
Orlando,"Days Inn by Wyndham Orlando Airport Florida Mall, Orlando",HOTEL,$55 ,2.5-star,"See all 1,611 Hotels.com reviews",6.6,"1 room, 3 adults","['28.427315', '-81.404648']"
Orlando,"Sheraton Vistana Resort Villas, Lake Buena Vista / Orlando, Orlando",HOTEL,$179 ,4-star,"See all 1,843 Hotels.com reviews",9,"1 room, 3 adults","['28.368048', '-81.505216']"
Orlando,"Unno Boutique Hotel, Kissimmee",HOTEL,$66 ,3-star,"See all 1,843 Hotels.com reviews",2.6,"1 room, 3 adults","['28.289342', '-81.359226']"
Orlando,"Renaissance Orlando at SeaWorld, Orlando",HOTEL,$119 ,4-star,"From 3,943 reviews
TripAdvisor Traveller Rating",9,"1 room, 3 adults","['28.411703', '-81.467017']"
Orlando,"DoubleTree Suites by Hilton Orlando - Disney Springs® Area, Lake Buena Vista",HOTEL,$112 ,3.5-star,See all 434 Hotels.com reviews,8.4,"1 room, 3 adults","['28.379373', '-81.507472']"
Orlando,"Hyatt Place Orlando/Lake Buena Vista, Orlando",HOTEL,$109 ,3-star,"From 917 reviews
TripAdvisor Traveller Rating",9,"1 room, 3 adults","['28.385822', '-81.505897']"
Orlando,"Altamonte Hotel and Suites, Altamonte Springs",HOTEL,$84 ,2.5-star,See all 729 Hotels.com reviews,4.2,"1 room, 3 adults","['28.660289', '-81.390356']"
Orlando,"Best Western Lake Buena Vista - Disney Springs® Resort Area, Lake Buena Vista",HOTEL,$64 ,3-star,"See all 2,481 Hotels.com reviews",7.8,"1 room, 3 adults","['28.378202', '-81.507528']"
Orlando,"Embassy Suites Orlando International Drive I Drive 360, Orlando",HOTEL,$92 ,3.5-star,See all 725 Hotels.com reviews,8.8,"1 room, 3 adults","['28.446453', '-81.472505']"
Orlando,"Embassy Suites by Hilton Orlando-North, Altamonte Springs",HOTEL,$111 ,3.5-star,See all 455 Hotels.com reviews,8.6,"1 room, 3 adults","['28.663573', '-81.385374']"
Orlando,"Hyatt Regency Grand Cypress, Orlando",HOTEL,$149 ,4-star,"See all 1,732 Hotels.com reviews",9,"1 room, 3 adults","['28.385828', '-81.508499']"
Orlando,"Quality Inn & Suites Winter Park Village Area, Orlando",HOTEL,$71 ,2.5-star,See all 417 Hotels.com reviews,6.2,"1 room, 3 adults","['28.606751', '-81.387916']"
Orlando,"Four Points by Sheraton Orlando Convention Center, Orlando",HOTEL,$99 ,3-star,See all 263 Hotels.com reviews,6.4,"1 room, 3 adults","['28.4189', '-81.465945']"
Orlando,"Midpointe Hotel by Rosen Hotels & Resorts, Orlando",HOTEL,$51 ,2-star,See all 642 Hotels.com reviews,7.2,"1 room, 3 adults","['28.423148', '-81.462391']"
Orlando,"Red Roof Inn Orlando South - Florida Mall, Orlando",HOTEL,$64 ,2-star,See all 538 Hotels.com reviews,6.8,"1 room, 3 adults","['28.444886', '-81.402383']"
Orlando,"Days Inn by Wyndham Orlando/International Drive, Orlando",HOTEL,$44 ,2-star,"See all 2,096 Hotels.com reviews",4.2,"1 room, 3 adults","['28.462254', '-81.460458']"
Orlando,"Floridian Express International Drive, Orlando",HOTEL,$56 ,2.5-star,See all 904 Hotels.com reviews,6,"1 room, 3 adults","['28.460568', '-81.468116']"
Orlando,"Sonesta ES Suites Orlando - International Drive, Orlando",HOTEL,$129 ,3.5-star,See all 859 Hotels.com reviews,8.8,"1 room, 3 adults","['28.441941', '-81.47115']"
Orlando,"Staybridge Suites Orlando/Lake Buena Vista, Orlando",HOTEL,$109 ,3-star,See all 418 Hotels.com reviews,8.8,"1 room, 3 adults","['28.389693', '-81.505303']"
Orlando,"Days Inn & Suites by Wyndham Orlando Airport, Orlando",HOTEL,$66 ,2-star,"See all 1,299 Hotels.com reviews",6.6,"1 room, 3 adults","['28.451071', '-81.356734']"
Orlando,"La Quinta Inn by Wyndham Orlando Airport West, Orlando",HOTEL,$76 ,2.5-star,"See all 1,093 Hotels.com reviews",6.8,"1 room, 3 adults","['28.452129', '-81.338863']"
Orlando,"Best Western International Drive - Orlando, Orlando",HOTEL,$84 ,2.5-star,"See all 1,055 Hotels.com reviews",8.2,"1 room, 3 adults","['28.447039', '-81.471711']"
Orlando,"Hampton Inn Orlando-International Airport, Orlando",HOTEL,$98 ,2.5-star,See all 412 Hotels.com reviews,9,"1 room, 3 adults","['28.460259', '-81.307466']"
Orlando,"Rosen Inn, closest to Universal, Orlando",HOTEL,$70 ,3-star,"See all 2,377 Hotels.com reviews",8.4,"1 room, 3 adults","['28.45966', '-81.468967']"
Orlando,"Disney's BoardWalk Inn, Lake Buena Vista",HOTEL,$380 ,4-star,See all 102 Hotels.com reviews,9,"1 room, 3 adults","['28.364717', '-81.553556']"
Orlando,"Best Western Orlando Gateway Hotel, Orlando",HOTEL,$61 ,3-star,"See all 2,701 Hotels.com reviews",8.4,"1 room, 3 adults","['28.457668', '-81.464251']"
Orlando,"Ramada by Wyndham Kissimmee Gateway, Kissimmee",HOTEL,$51 ,3-star,"From 3,222 reviews
TripAdvisor Traveller Rating",6.8,"1 room, 3 adults","['28.332288', '-81.586428']"
Orlando,"Baymont by Wyndham Orlando Universal Blvd, Orlando",HOTEL,$63 ,3-star,See all 962 Hotels.com reviews,7.2,"1 room, 3 adults","['28.451354', '-81.465219']"
Orlando,"Caribe Royale All-Suite Hotel, Orlando",HOTEL,$82 ,4-star,"See all 4,805 Hotels.com reviews",8.4,"1 room, 3 adults","['28.357391', '-81.491759']"
Orlando,"Clarion Suites Kissimmee-Orlando Maingate, Kissimmee",HOTEL,$80 ,3-star,See all 530 Hotels.com reviews,7.6,"1 room, 3 adults","['28.343339', '-81.600861']"
Orlando,"GreenPoint Hotel Kissimmee, Kissimmee",HOTEL,$63 ,2.5-star,"From 341 reviews
TripAdvisor Traveller Rating",8.6,"1 room, 3 adults","['28.332971', '-81.493165']"
Orlando,"Days Inn by Wyndham Orlando Downtown, Orlando",HOTEL,$67 ,2-star,See all 670 Hotels.com reviews,5.4,"1 room, 3 adults","['28.508143', '-81.397402']"
Orlando,"SUNSOL International Drive, Orlando",HOTEL,$75 ,3-star,"See all 1,185 Hotels.com reviews",7.6,"1 room, 3 adults","['28.464322', '-81.460253']"
Orlando,"Disney's Coronado Springs Resort, Lake Buena Vista",HOTEL,$161 ,3.5-star,See all 872 Hotels.com reviews,8.4,"1 room, 3 adults","['28.361933', '-81.570229']"
Orlando,"Ramada by Wyndham Davenport Orlando South, Davenport",HOTEL,$50 ,2.5-star,See all 530 Hotels.com reviews,5.6,"1 room, 3 adults","['28.231799', '-81.649583']"
