city,hotel_name,acc_type,price,hotel_star,no_of_ratings,rating,occupancy,lat_long
Orlando,"Saratoga Resort Villas Kissimmee, Kissimmee",HOTEL,$119 ,3.5-star,See all 818 Hotels.com reviews,8.4,"1 room, 3 adults","['28.329742', '-81.47064']"
Orlando,"La Quinta by Wyndham Orlando South, Orlando",HOTEL,$59 ,2.5-star,See all 454 Hotels.com reviews,6.8,"1 room, 3 adults","['28.428266', '-81.405642']"
Orlando,"Champions World Resort, Kissimmee",HOTEL,$53 ,3-star,"See all 2,265 Hotels.com reviews",7.2,"1 room, 3 adults","['28.346815', '-81.634812']"
Orlando,"Park Inn by Radisson Resort & Conference Center Orlando, Kissimmee",HOTEL,$64 ,3-star,"See all 1,560 Hotels.com reviews",6.4,"1 room, 3 adults","['28.336718', '-81.588779']"
Orlando,"Orlando International Resort Club, Orlando",HOTEL,,3-star,See all 105 Hotels.com reviews,9.2,"1 room, 3 adults","['28.463776', '-81.452174']"
Orlando,"Legacy Vacation Resorts-Lake Buena Vista, Orlando",HOTEL,$108 ,3-star,See all 461 Hotels.com reviews,8.2,"1 room, 3 adults","['28.387509', '-81.499173']"
Orlando,"Marriott's Sabal Palms, Orlando",HOTEL,$259 ,4-star,See all 23 Hotels.com reviews,9.4,"1 room, 3 adults","['28.359855', '-81.50837']"
Orlando,"Marriott's Cypress Harbour Villas, Orlando",HOTEL,$219 ,4-star,See all 135 Hotels.com reviews,9.6,"1 room, 3 adults","['28.401282', '-81.472946']"
Orlando,"Marriott's Imperial Palm Villas, Orlando",HOTEL,$359 ,4-star,See all 6 Hotels.com reviews,9.4,"1 room, 3 adults","['28.361859', '-81.502755']"
Orlando,"Grand Beach by Diamond Resorts, Orlando",HOTEL,$121 ,3-star,"See all 1,157 Hotels.com reviews",9.2,"1 room, 3 adults","['28.361742', '-81.496355']"
Orlando,"Howard Johnson by Wyndham Lake Front Park Kissimmee, Kissimmee",HOTEL,$61 ,2-star,See all 366 Hotels.com reviews,6.2,"1 room, 3 adults","['28.332549', '-81.476534']"
Orlando,"Quality Inn & Suites Kissimmee by The Lake, Kissimmee",HOTEL,$70 ,2.5-star,"From 296 reviews
TripAdvisor Traveller Rating",7.8,"1 room, 3 adults","['28.341417', '-81.598306']"
Orlando,"Courtyard by Marriott Orlando East/UCF Area, Orlando",HOTEL,$119 ,3-star,See all 124 Hotels.com reviews,8.2,"1 room, 3 adults","['28.596925', '-81.21267']"
Orlando,"Amber Inn & Suites, Kissimmee",HOTEL,$83 ,2-star,"From 43 reviews
TripAdvisor Traveller Rating",5.6,"1 room, 3 adults","['28.313677', '-81.46754']"
Orlando,"Magnuson Hotel Kissimmee Maingate, Kissimmee",HOTEL,$30 ,2-star,"See all 1,312 Hotels.com reviews",5.2,"1 room, 3 adults","['28.319171', '-81.470512']"
Orlando,"Disney's BoardWalk Villas, Lake Buena Vista",HOTEL,$401 ,4-star,See all 49 Hotels.com reviews,9,"1 room, 3 adults","['28.364717', '-81.553541']"
Orlando,"Tropical Palms Resort, Kissimmee",HOTEL,,3-star,See all 369 Hotels.com reviews,8.2,"1 room, 3 adults","['28.325571', '-81.516582']"
Orlando,"Fairfield Inn By Marriott Orlando Airport, Orlando",HOTEL,$76 ,2.5-star,See all 290 Hotels.com reviews,9,"1 room, 3 adults","['28.460855', '-81.306396']"
Orlando,"Fairfield Inn & Suites Orlando Lake Buena Vista, Orlando",HOTEL,$83 ,3-star,"From 1,037 reviews
TripAdvisor Traveller Rating",8.6,"1 room, 3 adults","['28.38824', '-81.506259']"
Orlando,"Galleria Palms Hotel, Kissimmee",HOTEL,$72 ,2.5-star,"See all 2,172 Hotels.com reviews",8.6,"1 room, 3 adults","['28.335202', '-81.588479']"
Orlando,"Extended Stay America-Orlando-Convention Ctr-Sports Complex, Orlando",HOTEL,$71 ,2.5-star,See all 346 Hotels.com reviews,6,"1 room, 3 adults","['28.418951', '-81.467105']"
Orlando,"Fantasy World Resort, Kissimmee",HOTEL,,3.5-star,See all 850 Hotels.com reviews,8.2,"1 room, 3 adults","['28.334822', '-81.485319']"
Orlando,"Hampton Inn & Suites Orlando/East UCF Area, FL, Orlando",HOTEL,$116 ,2.5-star,See all 307 Hotels.com reviews,9.2,"1 room, 3 adults","['28.598861', '-81.215897']"
Orlando,"Westgate Vacation Villas Resort, Kissimmee",HOTEL,$119 ,3.5-star,"From 4,114 reviews
TripAdvisor Traveller Rating",7.2,"1 room, 3 adults","['28.328931', '-81.592867']"
Orlando,"Summer Bay Orlando by Exploria Resorts, Clermont",HOTEL,$83 ,3.5-star,"See all 1,219 Hotels.com reviews",8.4,"1 room, 3 adults","['28.347084', '-81.660507']"
Orlando,"Extended Stay America-Orlando-Convention Ctr-Universal Blvd, Orlando",HOTEL,$90 ,2.5-star,See all 548 Hotels.com reviews,7.2,"1 room, 3 adults","['28.438801', '-81.468181']"
Orlando,"Extended Stay America - Orlando - Lake Buena Vista, Orlando",HOTEL,$76 ,2.5-star,See all 235 Hotels.com reviews,6.6,"1 room, 3 adults","['28.391348', '-81.496577']"
Orlando,"Westgate Palace a Two Bedroom Condo Resort, Orlando",HOTEL,$189 ,4-star,"See all 1,051 Hotels.com reviews",7.8,"1 room, 3 adults","['28.455918', '-81.465342']"
Orlando,"Extended Stay America - Orlando Theme Parks - Vineland Rd., Orlando",HOTEL,$81 ,2.5-star,See all 293 Hotels.com reviews,6.8,"1 room, 3 adults","['28.482007', '-81.455546']"
Orlando,"Ramada by Wyndham Suites Orlando Airport, Orlando",HOTEL,$92 ,3-star,"See all 1,151 Hotels.com reviews",7.4,"1 room, 3 adults","['28.456701', '-81.307562']"
Orlando,"La Quinta by Wyndham Orlando Airport North, Orlando",HOTEL,$93 ,2.5-star,"See all 1,453 Hotels.com reviews",8.6,"1 room, 3 adults","['28.459169', '-81.31296']"
Orlando,"Extended Stay America - Orlando - Altamonte Springs, Altamonte Springs",HOTEL,$62 ,2.5-star,See all 809 Hotels.com reviews,6.8,"1 room, 3 adults","['28.657121', '-81.386052']"
Orlando,"Hawthorn Suites by Wyndham Orlando Altamonte Springs, Altamonte Springs",HOTEL,$71 ,3-star,See all 709 Hotels.com reviews,7.8,"1 room, 3 adults","['28.673223', '-81.386337']"
Orlando,"Courtyard by Marriott Altamonte Springs/Maitland, Orlando",HOTEL,$89 ,3-star,See all 144 Hotels.com reviews,8.6,"1 room, 3 adults","['28.632763', '-81.400529']"
Orlando,"Extended Stay America - Orlando - Southpark - Equity Row, Orlando",HOTEL,$75 ,2.5-star,See all 387 Hotels.com reviews,6.4,"1 room, 3 adults","['28.444753', '-81.428703']"
Orlando,Comfort Suites UCF/Research Park,HOTEL,$81 ,2.5-star,See all 347 Hotels.com reviews,8.8,"1 room, 3 adults","['28.573414', '-81.206669']"
Orlando,"Courtyard by Marriott Orlando Downtown, Orlando",HOTEL,$143 ,3-star,See all 356 Hotels.com reviews,9,"1 room, 3 adults","['28.553993', '-81.376884']"
Orlando,"Best Western Plus Universal Inn, Orlando",HOTEL,$100 ,2.5-star,"See all 1,071 Hotels.com reviews",8.4,"1 room, 3 adults","['28.482833', '-81.457103']"
Orlando,"Wingate by Wyndham Convention Ctr Closest Universal Orlando, Orlando",HOTEL,$98 ,2.5-star,"See all 1,353 Hotels.com reviews",8.2,"1 room, 3 adults","['28.485708', '-81.457096']"
Orlando,"HomeTowne Studios Orlando - UCF Area, Orlando",HOTEL,$63 ,2-star,See all 338 Hotels.com reviews,5.2,"1 room, 3 adults","['28.565449', '-81.196133']"
Orlando,"Embassy Suites by Hilton Orlando Airport , Orlando",HOTEL,$129 ,3.5-star,See all 223 Hotels.com reviews,8.6,"1 room, 3 adults","['28.460704', '-81.306409']"
Orlando,"Westgate Towers Resort, Kissimmee",HOTEL,$89 ,3.5-star,"From 724 reviews
TripAdvisor Traveller Rating",8.4,"1 room, 3 adults","['28.334971', '-81.59102']"
Orlando,"Golden Link Resort Motel, Kissimmee",HOTEL,$38 ,2-star,See all 557 Hotels.com reviews,7,"1 room, 3 adults","['28.332832', '-81.47963']"
Orlando,"Holiday Villas of Kissimmee, Kissimmee",HOTEL,,3-star,See all 557 Hotels.com reviews,7.8,"1 room, 3 adults","['28.332966', '-81.587488']"
Orlando,"Econo Lodge Inn & Suites Maingate Central, Kissimmee",HOTEL,$28 ,2-star,"See all 1,134 Hotels.com reviews",6,"1 room, 3 adults","['28.316359', '-81.468796']"
Orlando,"Marriott's Royal Palms, Orlando",HOTEL,$229 ,4-star,See all 33 Hotels.com reviews,9.6,"1 room, 3 adults","['28.361866', '-81.502765']"
Orlando,"Ventura Resort Rentals Orlando, Orlando",HOTEL,,3-star,See all 16 Hotels.com reviews,6.8,"1 room, 3 adults","['28.478806', '-81.449356']"
Orlando,"Westgate Blue Tree Resort in Lake Buena Vista, Orlando",HOTEL,$129 ,3-star,"From 124 reviews
TripAdvisor Traveller Rating",8,"1 room, 3 adults","['28.389032', '-81.502982']"
Orlando,"Villages at Mango Key by 1st for Orlando, Kissimmee",HOTEL,,3.5-star,"From 63 reviews
TripAdvisor Traveller Rating",,"1 room, 3 adults","['28.343371', '-81.638452']"
Orlando,"Star Island Resort and Club, Kissimmee",HOTEL,$93 ,3.5-star,"From 3,419 reviews
TripAdvisor Traveller Rating",8.4,"1 room, 3 adults","['28.329774', '-81.484794']"
Orlando,"Monumental Hotel Orlando, Orlando",HOTEL,$72 ,3.5-star,See all 348 Hotels.com reviews,7.8,"1 room, 3 adults","['28.389414', '-81.471439']"
Orlando,"Disney's All-Star Movies Resort, Lake Buena Vista",HOTEL,$129 ,3-star,"See all 1,147 Hotels.com reviews",8.2,"1 room, 3 adults","['28.337341', '-81.570879']"
Orlando,"Universal's Loews Portofino Bay Hotel, Orlando",HOTEL,$374 ,4-star,See all 424 Hotels.com reviews,9.2,"1 room, 3 adults","['28.479061', '-81.463941']"
Orlando,"Hampton Inn Orlando International Drive/Conv Ctr, Orlando",HOTEL,$76 ,2.5-star,See all 774 Hotels.com reviews,8.6,"1 room, 3 adults","['28.436506', '-81.468121']"
Orlando,"Hyatt Place Orlando Convention Center, Orlando",HOTEL,$86 ,3-star,See all 471 Hotels.com reviews,8.8,"1 room, 3 adults","['28.43815', '-81.469958']"
Orlando,"Hampton Inn Lake Buena Vista / Orlando, Orlando",HOTEL,$111 ,2.5-star,See all 486 Hotels.com reviews,9,"1 room, 3 adults","['28.390258', '-81.496911']"
Orlando,"Extended Stay America-Orlando-Southpark-Commodity Circle, Orlando",HOTEL,$66 ,2.5-star,See all 379 Hotels.com reviews,6.6,"1 room, 3 adults","['28.44586', '-81.429534']"
Orlando,"Hilton Garden Inn Orlando Airport, Orlando",HOTEL,$125 ,3-star,See all 324 Hotels.com reviews,8.8,"1 room, 3 adults","['28.458626', '-81.307112']"
Orlando,"Quality Suites Lake Buena Vista, Orlando",HOTEL,$95 ,2.5-star,See all 853 Hotels.com reviews,8.4,"1 room, 3 adults","['28.389235', '-81.497231']"
Orlando,"La Quinta by Wyndham Orlando UCF, Orlando",HOTEL,$84 ,2.5-star,See all 551 Hotels.com reviews,8.4,"1 room, 3 adults","['28.588071', '-81.206839']"
Orlando,"La Quinta by Wyndham Orlando I Drive/Conv Center, Orlando",HOTEL,$76 ,2.5-star,See all 446 Hotels.com reviews,7.4,"1 room, 3 adults","['28.440694', '-81.468214']"
Orlando,"Hampton Inn Orlando-Maingate South, Davenport",HOTEL,$100 ,2.5-star,See all 208 Hotels.com reviews,8.4,"1 room, 3 adults","['28.235701', '-81.651658']"
Orlando,"Extended Stay America - Orlando Theme Parks - Major Blvd., Orlando",HOTEL,$71 ,2.5-star,See all 328 Hotels.com reviews,6.2,"1 room, 3 adults","['28.480887', '-81.454187']"
Orlando,"Comfort Suites Downtown, Orlando",HOTEL,$127 ,2.5-star,See all 294 Hotels.com reviews,8.2,"1 room, 3 adults","['28.57359', '-81.372866']"
Orlando,"Homewood Suites by Hilton Orlando-Int'l Drive/Convention Ctr, Orlando",HOTEL,$120 ,3-star,See all 798 Hotels.com reviews,8.8,"1 room, 3 adults","['28.438169', '-81.469991']"
Orlando,"Holiday Inn Resort Orlando Suites - Waterpark, Orlando",HOTEL,$80 ,3.5-star,"See all 3,150 Hotels.com reviews",7.4,"1 room, 3 adults","['28.356816', '-81.508602']"
Orlando,"Extended Stay America Orlando - Maitland - Pembrook Dr., Orlando",HOTEL,$70 ,2.5-star,See all 281 Hotels.com reviews,6.8,"1 room, 3 adults","['28.632759', '-81.400487']"
Orlando,"Residence Inn by Marriott Orlando Convention Center, Orlando",HOTEL,$99 ,3-star,See all 126 Hotels.com reviews,8.6,"1 room, 3 adults","['28.437486', '-81.468074']"
Orlando,"SpringHill Suites by Marriott Convention Center/I-drive, Orlando",HOTEL,$67 ,3-star,See all 542 Hotels.com reviews,8.8,"1 room, 3 adults","['28.437412', '-81.468077']"
Orlando,"Holiday Inn Express Orlando International Airport, Orlando",HOTEL,$88 ,2.5-star,See all 471 Hotels.com reviews,8.8,"1 room, 3 adults","['28.452881', '-81.334163']"
Orlando,"Extended Stay America - Orlando - Conv Ctr - 6443 Westwood, Orlando",HOTEL,$66 ,2.5-star,See all 424 Hotels.com reviews,6.8,"1 room, 3 adults","['28.418943', '-81.467109']"
Orlando,"The Floridian Hotel and Suites, Orlando",HOTEL,$63 ,2.5-star,See all 734 Hotels.com reviews,6.8,"1 room, 3 adults","['28.452466', '-81.468285']"
Orlando,"Bohemian Hotel Celebration, Autograph Collection, Celebration",HOTEL,$179 ,4-star,See all 160 Hotels.com reviews,9.2,"1 room, 3 adults","['28.317099', '-81.541237']"
Orlando,"Staybridge Suites Orlando Airport South, Orlando",HOTEL,$112 ,3-star,See all 288 Hotels.com reviews,8.6,"1 room, 3 adults","['28.457553', '-81.307131']"
Orlando,"Comfort Inn International Dr., Orlando",HOTEL,$80 ,2.5-star,See all 602 Hotels.com reviews,7.6,"1 room, 3 adults","['28.447935', '-81.470975']"
Orlando,"SureStay Hotel by Best Western Clermont Theme Park West, Clermont",HOTEL,$54 ,2.5-star,See all 192 Hotels.com reviews,7,"1 room, 3 adults","['28.346916', '-81.65966']"
Orlando,"The Eo Inn - Downtown, Orlando",HOTEL,$129 ,3-star,See all 252 Hotels.com reviews,8.4,"1 room, 3 adults","['28.545724', '-81.369311']"
Orlando,"HomeTowne Studios Orlando - Casselberry, Casselberry",HOTEL,$54 ,2-star,See all 326 Hotels.com reviews,4.6,"1 room, 3 adults","['28.660266', '-81.336803']"
Orlando,"HomeTowne Studios Orlando South, Orlando",HOTEL,$49 ,2-star,See all 162 Hotels.com reviews,3.4,"1 room, 3 adults","['28.429613', '-81.408044']"
Orlando,"Staymore Extended Studios Kissimmee, Kissimmee",HOTEL,,2.5-star,"From 49 reviews
TripAdvisor Traveller Rating",Poor2.6,"1 room, 3 adults","['28.304564', '-81.429353']"
Orlando,"Residence Inn by Marriott Orlando East/UCF Area, Orlando",HOTEL,$134 ,3-star,See all 28 Hotels.com reviews,8.2,"1 room, 3 adults","['28.597705', '-81.218237']"
Orlando,"Westgate Town Center Resort, Kissimmee",HOTEL,$129 ,3.5-star,See all 706 Hotels.com reviews,7.6,"1 room, 3 adults","['28.329022', '-81.597279']"
Orlando,"Destiny Palms Hotel Maingate West, Kissimmee",HOTEL,$60 ,2.5-star,"See all 1,307 Hotels.com reviews",8,"1 room, 3 adults","['28.346881', '-81.6279']"
Orlando,"Grande Villas Resort by Diamond Resorts, Orlando",HOTEL,$121 ,3.5-star,"See all 2,163 Hotels.com reviews",9,"1 room, 3 adults","['28.39028', '-81.503097']"
Orlando,"Extended Stay America - Orlando - Maitland-Summit Tower Blvd, Orlando",HOTEL,$75 ,2.5-star,See all 269 Hotels.com reviews,6.8,"1 room, 3 adults","['28.634206', '-81.403566']"
Orlando,"Comfort Inn Maingate, Kissimmee",HOTEL,$76 ,3-star,"See all 1,120 Hotels.com reviews",7.8,"1 room, 3 adults","['28.337308', '-81.593431']"
Orlando,"La Quinta by Wyndham Orlando Universal area, Orlando",HOTEL,$72 ,2.5-star,"See all 1,050 Hotels.com reviews",7.2,"1 room, 3 adults","['28.480707', '-81.453268']"
Orlando,"Best Western Airport Inn & Suites, Orlando",HOTEL,$94 ,2.5-star,"See all 1,459 Hotels.com reviews",7.6,"1 room, 3 adults","['28.45044', '-81.356737']"
Orlando,"Wyndham Cypress Palms, Kissimmee",HOTEL,,3.5-star,"From 1,165 reviews
TripAdvisor Traveller Rating",8.4,"1 room, 3 adults","['28.329624', '-81.49685']"
Orlando,"Resort at Heritage Park, Kissimmee",HOTEL,,2-star,"From 1,165 reviews
TripAdvisor Traveller Rating",2,"1 room, 3 adults","['28.290538', '-81.361175']"
Orlando,"Extended Stay America - Orlando - Maitland -1760 Pembrook Dr, Orlando",HOTEL,$66 ,2.5-star,"From 130 reviews
TripAdvisor Traveller Rating",6,"1 room, 3 adults","['28.632787', '-81.40117']"
Orlando,"Comfort Suites Maingate East, Kissimmee",HOTEL,$99 ,3-star,"See all 1,415 Hotels.com reviews",9,"1 room, 3 adults","['28.329288', '-81.513882']"
Orlando,"Holiday Inn Express Clermont, Clermont",HOTEL,$98 ,2.5-star,See all 139 Hotels.com reviews,9,"1 room, 3 adults","['28.544175', '-81.74238']"
Orlando,"Courtyard Orlando Lake Buena Vista in the Marriott Village, Orlando",HOTEL,$89 ,3-star,See all 775 Hotels.com reviews,8.6,"1 room, 3 adults","['28.377673', '-81.500808']"
Orlando,"SpringHill Suites Orlando Lake Buena Vista Marriott Village, Orlando",HOTEL,$98 ,3-star,"See all 1,155 Hotels.com reviews",8.4,"1 room, 3 adults","['28.377663', '-81.500811']"
Orlando,"Monumental Movieland Hotel Orlando, Orlando",HOTEL,$54 ,3-star,See all 584 Hotels.com reviews,6,"1 room, 3 adults","['28.461766', '-81.466118']"
Orlando,"Fairfield Inn & Suites Lake Buena Vista in Marriott Village, Orlando",HOTEL,$89 ,3-star,"See all 1,225 Hotels.com reviews",8.6,"1 room, 3 adults","['28.377663', '-81.500807']"
Orlando,"Embassy Suites Orlando - Downtown, Orlando",HOTEL,$179 ,3.5-star,See all 260 Hotels.com reviews,8.6,"1 room, 3 adults","['28.541351', '-81.375317']"
Orlando,"Homewood Suites by Hilton Orlando-Maitland, Maitland",HOTEL,$92 ,3-star,See all 272 Hotels.com reviews,9.2,"1 room, 3 adults","['28.629215', '-81.393452']"
Orlando,"Quality Inn Davenport - Maingate South, Davenport",HOTEL,$63 ,2.5-star,See all 203 Hotels.com reviews,6.4,"1 room, 3 adults","['28.236486', '-81.652114']"
Orlando,"Hawthorn Suites by Wyndham Lake Buena Vista, a staySky Hotel, Orlando",HOTEL,$83 ,3-star,"See all 1,248 Hotels.com reviews",8,"1 room, 3 adults","['28.389266', '-81.497428']"
Orlando,"Best Western Orlando Convention Center Hotel, Orlando",HOTEL,$72 ,2.5-star,See all 466 Hotels.com reviews,8,"1 room, 3 adults","['28.418819', '-81.463868']"
Orlando,"Universal's Hard Rock Hotel ®, Orlando",HOTEL,$354 ,4-star,See all 851 Hotels.com reviews,9,"1 room, 3 adults","['28.478991', '-81.464051']"
Orlando,"Springhill Suites By Marriott Orlando Altamonte Springs, Altamonte Springs",HOTEL,$88 ,2.5-star,See all 299 Hotels.com reviews,8.8,"1 room, 3 adults","['28.662036', '-81.391374']"
Orlando,"Hyatt Place across from Universal Orlando Resort, Orlando",HOTEL,$98 ,3-star,See all 589 Hotels.com reviews,8.4,"1 room, 3 adults","['28.475984', '-81.456671']"
Orlando,"staySky Suites - I Drive Orlando, Orlando",HOTEL,$80 ,3-star,See all 948 Hotels.com reviews,7.8,"1 room, 3 adults","['28.45181', '-81.468199']"
Orlando,"Sheraton Vistana Villages Resort Villas, I-Drive/Orlando, Orlando",HOTEL,$139 ,4-star,"See all 1,627 Hotels.com reviews",8.8,"1 room, 3 adults","['28.387298', '-81.477628']"
Orlando,"Holiday Inn Express & Suites Nearest Universal Orlando, Orlando",HOTEL,$97 ,2.5-star,See all 276 Hotels.com reviews,8,"1 room, 3 adults","['28.481626', '-81.455049']"
Orlando,"Comfort Inn & Suites near Universal Orlando Resort, Orlando",HOTEL,$72 ,2.5-star,See all 757 Hotels.com reviews,8,"1 room, 3 adults","['28.453002', '-81.468513']"
Orlando,"SpringHill Suites by Marriott Orlando Kissimmee, Kissimmee",HOTEL,$87 ,3-star,See all 320 Hotels.com reviews,9,"1 room, 3 adults","['28.338145', '-81.482425']"
Orlando,"Hyatt Place Orlando Airport, Orlando",HOTEL,$95 ,3-star,See all 424 Hotels.com reviews,8.6,"1 room, 3 adults","['28.460396', '-81.313195']"
Orlando,"Country Inn & Suites by Radisson, Orlando, FL, Orlando",HOTEL,$71 ,2.5-star,See all 904 Hotels.com reviews,7.2,"1 room, 3 adults","['28.452905', '-81.46475']"
Orlando,"Hilton Grand Vacations at SeaWorld, Orlando",HOTEL,$95 ,4-star,See all 964 Hotels.com reviews,8.8,"1 room, 3 adults","['28.406245', '-81.469712']"
Orlando,"Beachtree Villas, Kissimmee",HOTEL,,3-star,"From 92 reviews
TripAdvisor Traveller Rating",8.2,"1 room, 3 adults","['28.319106', '-81.48007']"
Orlando,"Grand Bohemian Orlando, Autograph Collection, Orlando",HOTEL,$239 ,4.5-star,See all 288 Hotels.com reviews,8.8,"1 room, 3 adults","['28.53863', '-81.379001']"
Orlando,"Marriott's Harbour Lake, Orlando",HOTEL,$139 ,3-star,See all 231 Hotels.com reviews,9.4,"1 room, 3 adults","['28.403268', '-81.477398']"
Orlando,"Hilton Garden Inn Orlando East/UCF, Orlando",HOTEL,$108 ,3-star,See all 242 Hotels.com reviews,8.8,"1 room, 3 adults","['28.571625', '-81.207628']"
Orlando,"Holiday Inn Club Vacations Orlando Breeze Resort, Davenport",HOTEL,$119 ,3.5-star,See all 44 Hotels.com reviews,9,"1 room, 3 adults","['28.340619', '-81.673216']"
Orlando,"Disney's Animal Kingdom Lodge, Lake Buena Vista",HOTEL,$304 ,4-star,"From 7,848 reviews
TripAdvisor Traveller Rating",9,"1 room, 3 adults","['28.352889', '-81.593063']"
Orlando,"Disney's Pop Century Resort, Lake Buena Vista",HOTEL,$126 ,3-star,"See all 1,265 Hotels.com reviews",8.4,"1 room, 3 adults","['28.351207', '-81.541143']"
Orlando,"Residence Inn by Marriott Orlando Lake Buena Vista, Orlando",HOTEL,$89 ,3-star,See all 369 Hotels.com reviews,8.6,"1 room, 3 adults","['28.392606', '-81.493645']"
Orlando,"Hilton Garden Inn Orlando at SeaWorld, Orlando",HOTEL,$84 ,3-star,See all 667 Hotels.com reviews,8.8,"1 room, 3 adults","['28.410057', '-81.471149']"
Orlando,"Liki Tiki Village by Diamond Resorts, Winter Garden",HOTEL,$59 ,3.5-star,"See all 3,086 Hotels.com reviews",8.4,"1 room, 3 adults","['28.348943', '-81.654155']"
Orlando,"Parkway International Resort by Diamond Resorts, Kissimmee",HOTEL,$65 ,3-star,"See all 1,143 Hotels.com reviews",9,"1 room, 3 adults","['28.336506', '-81.534529']"
Orlando,"Red Roof Inn Orlando West - Ocoee, Ocoee",HOTEL,$90 ,2-star,See all 299 Hotels.com reviews,7.2,"1 room, 3 adults","['28.551599', '-81.546159']"
Orlando,"Sleep Inn & Suites Orlando International Airport, Orlando",HOTEL,$63 ,2.5-star,"See all 1,155 Hotels.com reviews",8,"1 room, 3 adults","['28.450979', '-81.357489']"
Orlando,"Fairfield Inn & Suites by Marriott Near Universal Orlando, Orlando",HOTEL,$124 ,2.5-star,See all 195 Hotels.com reviews,8.6,"1 room, 3 adults","['28.482819', '-81.457111']"
Orlando,"Fairfield Inn & Suites Orlando Int'l Drive/Convention Center, Orlando",HOTEL,$93 ,3-star,See all 408 Hotels.com reviews,8.6,"1 room, 3 adults","['28.445367', '-81.466732']"
Orlando,"Advantage Vacation Homes, Kissimmee",HOTEL,,3-star,"From 1 reviews
TripAdvisor Traveller Rating",7.6,"1 room, 3 adults","['28.345839', '-81.640829']"
Orlando,"Holiday Inn Express & Suites Orlando-South Lake Buena Vista, Kissimmee",HOTEL,$93 ,3-star,See all 173 Hotels.com reviews,8.4,"1 room, 3 adults","['28.338372', '-81.484522']"
Orlando,"Magical Memories Villas, Kissimmee",HOTEL,,3.5-star,See all 808 Hotels.com reviews,7,"1 room, 3 adults","['28.328823', '-81.489482']"
Orlando,"Courtyard at Lake Lucerne, Orlando",HOTEL,$179 ,2.5-star,See all 158 Hotels.com reviews,8.2,"1 room, 3 adults","['28.53565', '-81.375985']"
Orlando,"Westgate Lakes Resort & Spa Universal Studios Area, Orlando",HOTEL,$119 ,4-star,"See all 2,436 Hotels.com reviews",7.8,"1 room, 3 adults","['28.428934', '-81.47504']"
Orlando,"Gaylord Palms Resort & Convention Center, Kissimmee",HOTEL,$149 ,4-star,"See all 1,336 Hotels.com reviews",8.8,"1 room, 3 adults","['28.344363', '-81.52496']"
Orlando,"Marriott's Grande Vista, Orlando",HOTEL,$149 ,4-star,See all 851 Hotels.com reviews,8.8,"1 room, 3 adults","['28.395985', '-81.454921']"
Orlando,"Super 8 by Wyndham Kissimmee, Kissimmee",HOTEL,$50 ,2-star,See all 243 Hotels.com reviews,5.8,"1 room, 3 adults","['28.304555', '-81.42262']"
Orlando,"Super 8 by Wyndham Orlando International Drive, Orlando",HOTEL,$50 ,2-star,"From 1,799 reviews
TripAdvisor Traveller Rating",6.2,"1 room, 3 adults","['28.464561', '-81.460559']"
Orlando,"Super 8 by Wyndham Kissimmee/Maingate/Orlando Area, Kissimmee",HOTEL,$50 ,2-star,See all 564 Hotels.com reviews,7.2,"1 room, 3 adults","['28.332925', '-81.518745']"
Orlando,"Residence Inn by Marriott Orlando at SeaWorld, Orlando",HOTEL,$99 ,3-star,"See all 1,060 Hotels.com reviews",8.6,"1 room, 3 adults","['28.406492', '-81.474402']"
Orlando,"Universal's Loews Royal Pacific Resort, Orlando",HOTEL,$319 ,4-star,"See all 1,656 Hotels.com reviews",9.2,"1 room, 3 adults","['28.470401', '-81.467831']"
Orlando,"InTown Suites Orlando UCF, Orlando",HOTEL,$61 ,2-star,See all 188 Hotels.com reviews,3.8,"1 room, 3 adults","['28.59753', '-81.222376']"
Orlando,"InTown Suites Orlando/Florida Turnpike, Orlando",HOTEL,,2-star,See all 65 Hotels.com reviews,4,"1 room, 3 adults","['28.449232', '-81.416481']"
Orlando,"Comfort Suites Near Universal Orlando Resort, Orlando",HOTEL,$109 ,2.5-star,See all 444 Hotels.com reviews,8.8,"1 room, 3 adults","['28.481228', '-81.453845']"
Orlando,"Arnold Palmer's Bay Hill Club & Lodge, Orlando",HOTEL,$138 ,4-star,"From 274 reviews
TripAdvisor Traveller Rating",9.2,"1 room, 3 adults","['28.458428', '-81.509772']"
Orlando,"Disney's Beach Club Resort, Lake Buena Vista",HOTEL,$380 ,4-star,See all 96 Hotels.com reviews,8.8,"1 room, 3 adults","['28.373787', '-81.557319']"
Orlando,"Disney's Wilderness Lodge, Lake Buena Vista",HOTEL,$377 ,4-star,"From 624 reviews
TripAdvisor Traveller Rating",8.8,"1 room, 3 adults","['28.40606', '-81.573952']"
Orlando,"Polynesian Isles by Diamond Resorts, Kissimmee",HOTEL,$107 ,3-star,"From 1,119 reviews
TripAdvisor Traveller Rating",9.4,"1 room, 3 adults","['28.338385', '-81.495979']"
Orlando,"TownePlace Suites by Marriott Orlando East/UCF Area, Orlando",HOTEL,$87 ,2.5-star,See all 112 Hotels.com reviews,8.8,"1 room, 3 adults","['28.599666', '-81.214997']"
Orlando,"Red Carpet Inn, Kissimmee",HOTEL,$39 ,2.5-star,See all 199 Hotels.com reviews,4.2,"1 room, 3 adults","['28.320068', '-81.470783']"
Orlando,"Country Inn & Suites by Radisson, Orlando Airport, FL, Orlando",HOTEL,$101 ,3-star,"See all 2,394 Hotels.com reviews",7.8,"1 room, 3 adults","['28.460062', '-81.313411']"
Orlando,"Crowne Plaza Orlando Universal, Orlando",HOTEL,$108 ,4-star,See all 525 Hotels.com reviews,8.2,"1 room, 3 adults","['28.451459', '-81.465307']"
Orlando,"Maingate Magic Vacation Homes by IPG, Davenport",HOTEL,,3.5-star,"From 301 reviews
TripAdvisor Traveller Rating",7.2,"1 room, 3 adults","['28.297446', '-81.665579']"
Orlando,"Barefoot N Resort by Diamond Resorts, Kissimmee",HOTEL,$94 ,3-star,See all 543 Hotels.com reviews,9,"1 room, 3 adults","['28.329264', '-81.516597']"
Orlando,"Mystic Dunes Resort & Golf Club by Diamond Resorts, Kissimmee",HOTEL,$94 ,3.5-star,"See all 2,821 Hotels.com reviews",8.6,"1 room, 3 adults","['28.316417', '-81.591398']"
Orlando,"Orlando Continental Plaza Hotel, Orlando",HOTEL,$44 ,2-star,"From 1,642 reviews
TripAdvisor Traveller Rating",4.8,"1 room, 3 adults","['28.462996', '-81.465906']"
Orlando,"Exploria Express by Exploria Resorts, Clermont",HOTEL,$83 ,2.5-star,See all 912 Hotels.com reviews,8.2,"1 room, 3 adults","['28.3483', '-81.660157']"
